{
  "release_id": "rsl_child00000000001",
  "tenant_id": "tenant-blue",
  "org_scope_ref": {
    "org_id": "org-blue",
    "org_path": "/org-blue/soc"
  },
  "root": {
    "kind": "grant",
    "id": "rbg_root000000000001"
  },
  "target": {
    "kind": "reservation",
    "id": "rsr_child00000000001",
    "expected_version": 1
  },
  "consumed": {
    "cpu_millis": 20,
    "memory_byte_millis": 20000,
    "model_tokens": 200,
    "tool_calls": 2,
    "retrieved_bytes": 2000,
    "egress_bytes": 200
  },
  "returned": {
    "cpu_millis": 20,
    "memory_byte_millis": 20000,
    "model_tokens": 200,
    "tool_calls": 2,
    "retrieved_bytes": 2000,
    "egress_bytes": 200
  },
  "sequence": 3,
  "virtual_time_ms": 1030,
  "reason": "completed",
  "confers_authority": false
}
